{
  "evaluated_capabilities": [
    {
      "basis_observation_ids": [
        "media.rpicam.cameras",
        "media.rpicam.version",
        "media.libcamera.cameras",
        "media.gstreamer.version",
        "media.gstreamer.libcamera",
        "media.gstreamer.h264",
        "media.ffmpeg.version",
        "media.ffmpeg.encoders",
        "media.ffprobe.version",
        "media.v4l2.nodes"
      ],
      "decision": "unknown",
      "id": "camera.enumeration",
      "rationale": "Camera modes require target inspection."
    },
    {
      "basis_observation_ids": [
        "media.rpicam.cameras",
        "media.rpicam.version",
        "media.libcamera.cameras",
        "media.gstreamer.version",
        "media.gstreamer.libcamera",
        "media.gstreamer.h264",
        "media.ffmpeg.version",
        "media.ffmpeg.encoders",
        "media.ffprobe.version",
        "media.v4l2.nodes"
      ],
      "decision": "unknown",
      "id": "encoder.hardware_h264",
      "rationale": "Hardware H.264 requires a measured target test."
    },
    {
      "basis_observation_ids": [
        "audio.capture.devices",
        "audio.capture.pcms"
      ],
      "decision": "unknown",
      "id": "audio.capture",
      "rationale": "Audio compatibility requires the selected USB device."
    },
    {
      "basis_observation_ids": [
        "uart.serial0.mapping",
        "uart.kernel.cmdline",
        "uart.boot.config",
        "uart.legacy.boot.config"
      ],
      "decision": "unknown",
      "id": "uart.gps",
      "rationale": "UART mapping and stability require the target boot configuration."
    },
    {
      "basis_observation_ids": [
        "storage.block.layout",
        "storage.recording.mount",
        "storage.recording.space",
        "storage.exfat.module",
        "storage.exfat.fsck",
        "storage.exfat.mkfs",
        "storage.filesystems"
      ],
      "decision": "unknown",
      "id": "storage.exfat",
      "rationale": "exFAT safety requires the final card and mount identity."
    },
    {
      "basis_observation_ids": [
        "thermal.throttled",
        "thermal.temperature",
        "thermal.sysfs.temperature"
      ],
      "decision": "unknown",
      "id": "thermal.power",
      "rationale": "Thermal and power health require a target measurement."
    }
  ],
  "evidence_artifacts": [],
  "generated_at_utc": "2026-07-24T07:45:36.531250Z",
  "producer": {
    "build_id": "0.unknown",
    "name": "dashcam-capability-probe",
    "version": "0.unknown"
  },
  "raw_observations": {
    "audio": {
      "evidence_artifact_paths": [],
      "facts": [
        {
          "id": "audio.capture.devices",
          "key": "raw_output",
          "source": "arecord --list-devices",
          "state": "observed",
          "value": "**** List of CAPTURE Hardware Devices ****"
        },
        {
          "id": "audio.capture.pcms",
          "key": "raw_output",
          "source": "arecord --list-pcms",
          "state": "observed",
          "value": "null\n    Discard all samples (playback) or generate zero samples (capture)\ndefault\n    Default Audio Device\nsysdefault\n    Default Audio Device"
        }
      ],
      "state": "observed",
      "warnings": []
    },
    "hardware": {
      "evidence_artifact_paths": [],
      "facts": [
        {
          "id": "hardware.cpuinfo",
          "key": "raw_output",
          "source": "/proc/cpuinfo",
          "state": "observed",
          "value": "processor\t: 0\nmodel name\t: ARMv7 Processor rev 4 (v7l)\nBogoMIPS\t: 44.80\nFeatures\t: half thumb fastmult vfp edsp neon vfpv3 tls vfpv4 idiva idivt vfpd32 lpae evtstrm crc32 \nCPU implementer\t: 0x41\nCPU architecture: 7\nCPU variant\t: 0x0\nCPU part\t: 0xd03\nCPU revision\t: 4\n\nprocessor\t: 1\nmodel name\t: ARMv7 Processor rev 4 (v7l)\nBogoMIPS\t: 44.80\nFeatures\t: half thumb fastmult vfp edsp neon vfpv3 tls vfpv4 idiva idivt vfpd32 lpae evtstrm crc32 \nCPU implementer\t: 0x41\nCPU architecture: 7\nCPU variant\t: 0x0\nCPU part\t: 0xd03\nCPU revision\t: 4\n\nprocessor\t: 2\nmodel name\t: ARMv7 Processor rev 4 (v7l)\nBogoMIPS\t: 44.80\nFeatures\t: half thumb fastmult vfp edsp neon vfpv3 tls vfpv4 idiva idivt vfpd32 lpae evtstrm crc32 \nCPU implementer\t: 0x41\nCPU architecture: 7\nCPU variant\t: 0x0\nCPU part\t: 0xd03\nCPU revision\t: 4\n\nprocessor\t: 3\nmodel name\t: ARMv7 Processor rev 4 (v7l)\nBogoMIPS\t: 44.80\nFeatures\t: half thumb fastmult vfp edsp neon vfpv3 tls vfpv4 idiva idivt vfpd32 lpae evtstrm crc32 \nCPU implementer\t: 0x41\nCPU architecture: 7\nCPU variant\t: 0x0\nCPU part\t: 0xd03\nCPU revision\t: 4\n\nHardware\t: BCM2835\nRevision\t: 902120\nSerial\t\t: 00000000e36a511b\nModel\t\t: Raspberry Pi Zero 2 W Rev 1.0"
        },
        {
          "id": "hardware.meminfo",
          "key": "raw_output",
          "source": "/proc/meminfo",
          "state": "observed",
          "value": "MemTotal:         435192 kB\nMemFree:          102496 kB\nMemAvailable:     234472 kB\nBuffers:           11428 kB\nCached:           212680 kB\nSwapCached:          100 kB\nActive:           150760 kB\nInactive:          90212 kB\nActive(anon):      70968 kB\nInactive(anon):        0 kB\nActive(file):      79792 kB\nInactive(file):    90212 kB\nUnevictable:           0 kB\nMlocked:               0 kB\nSwapTotal:        434172 kB\nSwapFree:         398640 kB\nZswap:                 0 kB\nZswapped:              0 kB\nDirty:                 0 kB\nWriteback:             0 kB\nAnonPages:         17012 kB\nMapped:            30084 kB\nShmem:             53992 kB\nKReclaimable:      14312 kB\nSlab:              32864 kB\nSReclaimable:      14312 kB\nSUnreclaim:        18552 kB\nKernelStack:        1040 kB\nPageTables:         1488 kB\nSecPageTables:         0 kB\nNFS_Unstable:          0 kB\nBounce:                0 kB\nWritebackTmp:          0 kB\nCommitLimit:      651768 kB\nCommitted_AS:     181884 kB\nVmallocTotal:    1622016 kB\nVmallocUsed:        9132 kB\nVmallocChunk:          0 kB\nPercpu:              448 kB\nCmaTotal:         262144 kB\nCmaFree:           74560 kB\nBalloon:               0 kB"
        }
      ],
      "state": "observed",
      "warnings": []
    },
    "media": {
      "evidence_artifact_paths": [],
      "facts": [
        {
          "id": "media.rpicam.cameras",
          "key": "raw_output",
          "source": "rpicam-hello --list-cameras",
          "state": "observed",
          "value": "Available cameras\n-----------------\n0 : imx219 [3280x2464 10-bit RGGB] (/base/soc/i2c0mux/i2c@1/imx219@10)\n    Modes: 'SRGGB10_CSI2P' : 640x480 [200.16 fps - (1000, 752)/1280x960 crop]\n                             1640x1232 [81.07 fps - (0, 0)/3280x2464 crop]\n                             1920x1080 [47.57 fps - (680, 692)/1920x1080 crop]\n                             3280x2464 [21.19 fps - (0, 0)/3280x2464 crop]\n           'SRGGB8' : 640x480 [200.16 fps - (1000, 752)/1280x960 crop]\n                      1640x1232 [81.07 fps - (0, 0)/3280x2464 crop]\n                      1920x1080 [47.57 fps - (680, 692)/1920x1080 crop]\n                      3280x2464 [21.19 fps - (0, 0)/3280x2464 crop]"
        },
        {
          "id": "media.rpicam.version",
          "key": "raw_output",
          "source": "rpicam-hello --version",
          "state": "observed",
          "value": "rpicam-apps build: v1.12.0 12-05-2026 (11:49:26)\nrpicam-apps capabilites: egl:0 qt:0 drm:1 libav:0\nlibcamera build: v0.7.1+rpt20260609"
        },
        {
          "id": "media.libcamera.cameras",
          "key": "raw_output",
          "note": "executable not found: libcamera-hello",
          "source": "libcamera-hello --list-cameras",
          "state": "unavailable",
          "value": null
        },
        {
          "id": "media.gstreamer.version",
          "key": "raw_output",
          "source": "gst-inspect-1.0 --version",
          "state": "observed",
          "value": "gst-inspect-1.0 version 1.26.2\nGStreamer 1.26.2\nhttps://tracker.debian.org/pkg/gstreamer1.0"
        },
        {
          "id": "media.gstreamer.libcamera",
          "key": "raw_output",
          "note": "command output exceeded bound; raw evidence truncated to report bounds",
          "source": "gst-inspect-1.0 libcamerasrc",
          "state": "error",